{"schema_version":1,"exported_at_utc_ms":1789120800000,"source":"local","projects":[{"id":"59aa0322-8475-4683-8996-da76a504903a","name":"俯卧撑","unit":"个","icon_key":"dumbbell","quick_amount":10,"created_at_utc_ms":1789120800000,"updated_at_utc_ms":1789120800000,"archived":false}],"entries":[{"id":"ca63f93d-7551-4a26-beaf-b0bc34e2d8bf","project_id":"59aa0322-8475-4683-8996-da76a504903a","amount":10,"occurred_at_utc_ms":1789120800000,"utc_offset_minutes":480,"local_date":"2026-09-11","voided_at_utc_ms":1789120800000}]}